code,recommendation,recommendation2,recommendation3
4,고구마를 포함한 다양한 채소를 함께 섭취하여 영양을 공급하세요.,"""적절한 수면을 취하여 신체 리듬을 유지하세요.""",적절한 수면을 취하여 신체 리듬을 유지하세요.
4,구운 고구마를 함께 샐러드와 섭취하여 체지방을 조절하세요.,"""체중 관리를 위해 소량씩 자주 식사하는 것도 좋은 방법입니다.""",체중 관리를 위해 소량씩 자주 식사하는 것도 좋은 방법입니다.
4,토마토와 두부를 골고루 넣은 샐러드를 먹어서 혈압을 관리하세요.,"""건강한 지방을 섭취하세요. 아보카도와 올리브오일이 좋습니다.""",건강한 지방을 섭취하세요. 아보카도와 올리브오일이 좋습니다.
4,연어와 함께 매운 양념장으로 볶은 채소를 먹어서 체지방을 낮추세요.,"""적당한 운동을 통해 체지방을 줄이고 근육량을 늘리세요.""",적당한 운동을 통해 체지방을 줄이고 근육량을 늘리세요.
4,고단백 저지방의 계란 흰자와 떡국을 드시는 것이 좋습니다.,"""규칙적인 식사 습관을 유지하고, 과식을 피하세요.""","규칙적인 식사 습관을 유지하고, 과식을 피하세요."
4,비타민 B가 풍부한 두부와 함께 미역국을 드시는 것이 좋습니다.,"""단백질이 풍부한 식사를 하여 포만감을 느끼도록 하세요.""",단백질이 풍부한 식사를 하여 포만감을 느끼도록 하세요.
4,비타민 B가 풍부한 삼겹살 샐러드를 먹어서 체지방을 관리하세요.,"""체중 관리를 위해 하루에 30분 이상 운동을 해보세요.""",체중 관리를 위해 하루에 30분 이상 운동을 해보세요.
4,고단백 저지방의 우유를 섭취하여 체지방을 조절하세요.,"""식사 후에는 가벼운 운동을 하여 소화를 돕고, 체중 감량을 도모하세요.""","식사 후에는 가벼운 운동을 하여 소화를 돕고, 체중 감량을 도모하세요."
4,생선과 함께 두부가 들어간 찌개를 먹어서 체지방을 낮추세요.,"""건강한 식단을 유지하고, 적당한 운동을 통해 비만을 관리하세요.""","건강한 식단을 유지하고, 적당한 운동을 통해 비만을 관리하세요."
4,"삶은 달걀과 시금치를 함께 드세요. 달걀은 단백질과 비타민 B12를 제공하며, 시금치는 철분과 엽산이 풍부하여 빈혈 예방에 좋습니다.","""포화지방과 설탕 섭취를 줄이고, 식이섬유가 풍부한 음식을 선택하세요.""","포화지방과 설탕 섭취를 줄이고, 식이섬유가 풍부한 음식을 선택하세요."
4,칼슘과 비타민 D가 풍부한 멸치와 시금치를 넣어 만든 된장국을 드시면 갑상선 기능 안정에 도움이 됩니다.,매일 7시간 이상의 충분한 수면을 취하세요.,매일 7시간 이상의 충분한 수면을 취하세요.
4,브로콜리와 닭가슴살을 넣어 만든 샐러드는 칼슘과 단백질을 제공하여 갑상선 건강을 지원합니다.,가족과 함께 건강한 식습관을 실천해보세요.,가족과 함께 건강한 식습관을 실천해보세요.
4,저요오드 식단을 위해 구운 두부와 다양한 채소를 곁들인 두부 샐러드는 건강한 지방과 단백질을 제공합니다.,저염 간장이나 소금을 대체할 수 있는 재료를 사용해보세요.,저염 간장이나 소금을 대체할 수 있는 재료를 사용해보세요.
4,비타민이 많은 배추와 당근을 넣어 만든 김치볶음밥은 갑상선 기능을 안정화하는 데 도움이 됩니다.,주말마다 자연 속에서 시간을 보내며 스트레스를 풀어보세요.,주말마다 자연 속에서 시간을 보내며 스트레스를 풀어보세요.
4,칼슘이 풍부한 시금치와 연두부를 넣어 만든 샐러드는 갑상선 건강을 유지하는 데 좋습니다.,규칙적인 체중 관리를 통해 목표를 설정하세요.,규칙적인 체중 관리를 통해 목표를 설정하세요.
4,고구마와 브로콜리를 넣어 만든 채소 그라탱은 비타민과 미네랄이 풍부하여 갑상선 기능을 지원합니다.,주기적으로 혈당 수치를 체크하여 건강을 유지하세요.,주기적으로 혈당 수치를 체크하여 건강을 유지하세요.
4,단백질이 많은 두부와 칼슘이 풍부한 케일을 넣어 만든 샐러드는 갑상선 건강을 돕습니다.,가족과 함께 요가 수업을 들어보세요.,가족과 함께 요가 수업을 들어보세요.
4,해조류를 피하고 생선 대신 구운 닭가슴살과 채소를 함께 드시면 갑상선 기능 안정에 도움이 됩니다.,적절한 양의 단백질을 섭취하여 근육을 유지하세요.,적절한 양의 단백질을 섭취하여 근육을 유지하세요.
4,당근과 시금치를 넣어 만든 현미밥 비빔밥은 비타민과 섬유질이 풍부하여 갑상선 건강을 지원합니다.,긍정적인 마인드로 하루를 시작하는 명상을 해보세요.,긍정적인 마인드로 하루를 시작하는 명상을 해보세요.
4,칼슘이 많은 멸치와 신선한 채소를 넣어 만든 샐러드는 갑상선 기능을 안정화하는 데 좋습니다.,매일 새로운 것을 배우는 시간을 가지세요.,매일 새로운 것을 배우는 시간을 가지세요.
4,양배추와 단백질이 많은 두부를 넣어 만든 된장찌개는 갑상선 건강을 유지하는 데 좋은 영향을 줍니다.,자기 전에 따뜻한 목욕을 하여 피로를 풀어보세요.,자기 전에 따뜻한 목욕을 하여 피로를 풀어보세요.
4,저요오드 식단을 위해 구운 연어와 신선한 채소를 넣어 만든 샐러드는 건강한 지방과 단백질을 제공합니다.,식사 중에는 TV나 스마트폰을 멀리하고 집중하세요.,식사 중에는 TV나 스마트폰을 멀리하고 집중하세요.
4,칼슘이 풍부한 시금치와 고구마를 넣어 만든 채소 볶음은 갑상선 기능을 안정화하는 데 도움이 됩니다.,정기적으로 플랭크와 같은 코어 운동을 하세요.,정기적으로 플랭크와 같은 코어 운동을 하세요.
4,브로콜리와 닭가슴살을 넣어 만든 샐러드는 단백질과 칼슘이 풍부하여 갑상선 건강을 지원합니다.,친구와 함께 운동을 하며 동기부여를 얻으세요.,친구와 함께 운동을 하며 동기부여를 얻으세요.
4,단백질이 많은 두부와 비타민이 풍부한 배추를 넣어 만든 김치찌개는 갑상선 기능 안정에 도움이 됩니다.,집안을 깨끗하게 유지하고 정리 정돈을 습관화하세요.,집안을 깨끗하게 유지하고 정리 정돈을 습관화하세요.
4,저요오드 식단을 위해 구운 닭가슴살과 신선한 채소를 곁들인 샐러드는 건강한 지방과 단백질을 제공합니다.,매일 웃는 시간을 가져보세요.,매일 웃는 시간을 가져보세요.
4,브로콜리와 고구마를 넣어 만든 채소 스프는 비타민과 미네랄이 풍부하여 갑상선 기능을 지원합니다.,일주일에 한 번은 새로운 식재료를 사용해 요리해 보세요.,일주일에 한 번은 새로운 식재료를 사용해 요리해 보세요.
4,칼슘이 많은 시금치와 두부를 넣어 만든 샐러드는 갑상선 건강을 유지하는 데 좋습니다.,정기적으로 건강 관련 서적이나 기사를 읽어보세요.,정기적으로 건강 관련 서적이나 기사를 읽어보세요.
4,단백질이 풍부한 연두부와 다양한 신선한 채소를 넣어 만든 샐러드는 갑상선 기능을 안정화하는 데 도움이 됩니다.,자기 전에 따뜻한 차를 마시며 마음을 안정시키세요.,자기 전에 따뜻한 차를 마시며 마음을 안정시키세요.
4,해조류를 피하고 고등어 대신 구운 연어와 채소를 함께 드시면 갑상선 건강을 지원합니다.,식사 시간을 규칙적으로 유지하세요.,식사 시간을 규칙적으로 유지하세요.
4,당근과 시금치를 넣어 만든 현미밥 비빔밥은 비타민과 섬유질이 풍부하여 갑상선 기능을 안정화합니다.,한 주에 한 번은 디지털 디톡스를 시도해 보세요.,한 주에 한 번은 디지털 디톡스를 시도해 보세요.
4,단백질이 많은 두부와 비타민이 풍부한 양배추를 넣어 만든 된장국은 갑상선 건강을 유지하는 데 좋습니다.,자연 속에서 시간을 보내며 마음을 치유하세요.,자연 속에서 시간을 보내며 마음을 치유하세요.
4,칼슘이 풍부한 시금치와 고구마를 넣어 만든 채소 그라탱은 갑상선 기능을 지원합니다.,정기적으로 정원 가꾸기나 식물 돌보기를 해보세요.,정기적으로 정원 가꾸기나 식물 돌보기를 해보세요.
4,브로콜리와 닭가슴살을 넣어 만든 샐러드는 단백질과 칼슘이 풍부하여 갑상선 건강을 돕습니다.,가족과 함께 하는 식사 시간을 소중히 여기세요.,가족과 함께 하는 식사 시간을 소중히 여기세요.
4,비타민이 많은 배추와 단백질이 풍부한 두부를 넣어 만든 김치볶음밥은 갑상선 기능 안정에 도움이 됩니다.,매일 새로운 단어를 배우고 사용해 보세요.,매일 새로운 단어를 배우고 사용해 보세요.
4,저요오드 식단을 위해 구운 연어와 신선한 채소를 넣어 만든 샐러드는 건강한 지방과 단백질을 제공합니다.,아침마다 신선한 공기를 마시며 창문을 열어 환기하세요.,아침마다 신선한 공기를 마시며 창문을 열어 환기하세요.
4,브로콜리와 고구마를 넣어 만든 채소 스프는 비타민과 미네랄이 풍부하여 갑상선 기능을 지원합니다.,하루에 한 번은 자신을 칭찬하고 격려하세요.,하루에 한 번은 자신을 칭찬하고 격려하세요.
4,단백질이 많은 연두부와 다양한 신선한 채소를 넣어 만든 샐러드는 갑상선 기능을 안정화하는 데 좋습니다.,자신에게 맞는 운동화를 신어 발 건강을 지키세요.,자신에게 맞는 운동화를 신어 발 건강을 지키세요.
4,해조류를 피하고 생선 대신 구운 닭가슴살과 채소를 함께 드시면 갑상선 건강을 유지하는 데 도움이 됩니다.,정기적으로 스트레칭을 하여 유연성을 유지하세요.,정기적으로 스트레칭을 하여 유연성을 유지하세요.
4,당근과 시금치를 넣어 만든 현미밥 비빔밥은 비타민과 섬유질이 풍부하여 갑상선 기능을 안정화합니다.,하루에 10분씩 바른 자세로 앉아 명상을 해보세요.,하루에 10분씩 바른 자세로 앉아 명상을 해보세요.
5,고구마와 함께 버섯전골을 먹어서 체력을 유지하세요.,"""오늘 하루도 수고 많으셨습니다. 체력이 부족하겠지만, 규칙적인 유산소 운동이 대사 속도를 높여 갑상선 기능을 돕습니다.""","오늘 하루도 수고 많으셨습니다. 체력이 부족하겠지만, 규칙적인 유산소 운동이 대사 속도를 높여 갑상선 기능을 돕습니다."
5,닭가슴살과 야채를 골고루 넣은 볶음밥을 먹어서 에너지를 공급하세요.,"""규칙적인 식사와 충분한 수면은 갑상선 기능을 유지하는 데 도움이 됩니다.""",규칙적인 식사와 충분한 수면은 갑상선 기능을 유지하는 데 도움이 됩니다.
5,두부와 토마토를 골고루 넣은 샐러드를 먹어서 체지방을 관리하세요.,"""갑상선 저하증 환자에게는 영양가 높고 건강한 식사가 중요합니다. 과일과 채소를 많이 섭취하세요.""",갑상선 저하증 환자에게는 영양가 높고 건강한 식사가 중요합니다. 과일과 채소를 많이 섭취하세요.
5,"흰빵 대신 통밀빵을 선택하시고, 과일주스 대신 신선한 과일을 드시는 것을 권장드립니다. 통밀빵은 섬유질이 풍부하여 포만감을 오래 유지해줍니다.","""하루 30분 이상의 산책은 갑상선 기능을 증진시키고, 에너지를 회복하는 데 도움이 됩니다.""","하루 30분 이상의 산책은 갑상선 기능을 증진시키고, 에너지를 회복하는 데 도움이 됩니다."
5,"백미 대신 현미밥을 드시고, 고기 대신 단백질이 풍부한 닭가슴살을 드시는 것이 좋습니다. 닭가슴살은 저지방 단백질을 제공합니다.","""스트레스 관리를 위해 명상이나 균형 잡힌 생활습관을 유지하세요.""",스트레스 관리를 위해 명상이나 균형 잡힌 생활습관을 유지하세요.
5,"채소가 풍부한 샐러드를 준비하시고, 드레싱은 올리브 오일과 발사믹 식초를 사용하는 것을 추천드립니다. 올리브 오일은 건강한 지방을 제공합니다.","""갑상선 저하증을 관리하기 위해 적절한 수분 섭취가 중요합니다. 하루에 충분한 물을 마시세요.""",갑상선 저하증을 관리하기 위해 적절한 수분 섭취가 중요합니다. 하루에 충분한 물을 마시세요.
5,고당도 과일보다는 섬유질이 풍부한 사과나 배를 선택해보세요. 섬유질은 포만감을 유지해줍니다.,"""규칙적인 식사와 함께 간식으로는 과일이나 견과류를 선택하세요.""",규칙적인 식사와 함께 간식으로는 과일이나 견과류를 선택하세요.
5,계란 요리를 할 때는 튀기기보다는 삶거나 찐 계란을 드시는 것이 좋습니다. 계란은 단백질이 풍부합니다.,"""운동은 갑상선 기능을 개선하는 데 큰 도움이 됩니다. 꾸준히 실천해보세요.""",운동은 갑상선 기능을 개선하는 데 큰 도움이 됩니다. 꾸준히 실천해보세요.
5,당분이 높은 탄산음료보다는 무가당 녹차나 허브티를 드시는 것을 권장드립니다. 녹차는 항산화제가 풍부해 대사 기능을 돕습니다.,"""갑상선 저하증 환자는 과식을 피하고 규칙적인 식사 시간을 지키는 것이 중요합니다.""",갑상선 저하증 환자는 과식을 피하고 규칙적인 식사 시간을 지키는 것이 중요합니다.
5,"육류 섭취 시에는 기름기가 적은 닭가슴살이나 칠면조를 선택하시고, 조리 시에는 굽기나 찌기를 이용해보세요. 닭가슴살은 저지방 단백질을 제공합니다.","""건강한 식사와 함께 규칙적인 운동을 통해 체력을 강화하세요.""",건강한 식사와 함께 규칙적인 운동을 통해 체력을 강화하세요.
5,샐러드에 견과류를 추가하셔서 건강한 지방을 섭취하세요. 견과류는 불포화 지방산이 풍부합니다.,"""자주 식사하는 것이 갑상선 기능을 유지하는 데 도움이 됩니다.""",자주 식사하는 것이 갑상선 기능을 유지하는 데 도움이 됩니다.
5,"시리얼 대신 오트밀을 드시고, 우유는 저지방 또는 무지방 우유로 대체해보세요. 오트밀은 섬유질과 단백질이 풍부합니다.","""스트레스를 줄이기 위해 산책이나 요가와 같은 경미한 운동을 추천합니다.""",스트레스를 줄이기 위해 산책이나 요가와 같은 경미한 운동을 추천합니다.
5,고당도 과일보다는 섬유질이 풍부한 사과나 배를 선택해보세요. 섬유질은 포만감을 유지해줍니다.,"""갑상선 저하증 환자는 단 음식을 피하고 과일과 채소를 다양하게 섭취하세요.""",갑상선 저하증 환자는 단 음식을 피하고 과일과 채소를 다양하게 섭취하세요.
5,생선 섭취를 늘리기 위해 주 2회 정도 등푸른 생선인 고등어나 정어리를 드시는 것을 권장드립니다. 등푸른 생선은 오메가-3가 풍부해 대사 기능을 돕습니다.,"""하루 규칙적인 식사와 적절한 운동을 통해 체중을 관리하세요.""",하루 규칙적인 식사와 적절한 운동을 통해 체중을 관리하세요.
5,견과류 섭취 시에는 소금이 가미되지 않은 생아몬드나 호두를 선택하시면 좋습니다. 견과류는 건강한 지방과 단백질을 제공합니다.,"""갑상선 기능을 개선하기 위해 충분한 수면을 취하세요.""",갑상선 기능을 개선하기 위해 충분한 수면을 취하세요.
5,채소 섭취를 늘리기 위해 매 끼니마다 다양한 색상의 채소를 골고루 드시는 것을 추천드립니다. 다양한 색상의 채소에는 비타민과 미네랄이 풍부합니다.,"""건강한 식습관을 유지하고, 스트레스를 관리하는 것이 중요합니다.""","건강한 식습관을 유지하고, 스트레스를 관리하는 것이 중요합니다."
5,육류 대신 단백질을 보충할 수 있도록 두부나 콩류를 자주 드셔보세요. 두부와 콩류는 식물성 단백질과 섬유질을 제공합니다.,"""갑상선 저하증 환자에게는 비타민과 미네랄이 풍부한 식품을 섭취하는 것이 좋습니다.""",갑상선 저하증 환자에게는 비타민과 미네랄이 풍부한 식품을 섭취하는 것이 좋습니다.
5,고구마나 당근 스틱처럼 건강한 채소를 준비해보세요. 고구마와 당근에는 베타카로틴과 비타민 A가 풍부합니다.,"""규칙적인 운동 습관을 길러 체력을 키우고 갑상선 기능을 유지하세요.""",규칙적인 운동 습관을 길러 체력을 키우고 갑상선 기능을 유지하세요.
5,"조미료 사용을 줄이고, 신선한 허브나 향신료를 활용해 요리해보세요. 허브와 향신료는 항산화 효과가 있습니다.","""체중을 관리하고 싶다면 고단백, 저탄수화물 식단을 고려하세요.""","체중을 관리하고 싶다면 고단백, 저탄수화물 식단을 고려하세요."
5,신선한 과일과 함께 그릭 요거트를 곁들여 드시면 단백질과 칼슘을 함께 섭취할 수 있습니다.,"""갑상선 저하증 환자에게는 정기적인 식사와 충분한 수면이 필수적입니다.""",갑상선 저하증 환자에게는 정기적인 식사와 충분한 수면이 필수적입니다.
5,정제된 곡물보다는 통곡물을 선택하여 영양소와 섬유질 섭취를 늘리세요. 통곡물에는 비타민 B군과 식이섬유가 풍부합니다.,"""하루 세 끼 식사를 규칙적으로 하고, 간식은 건강한 선택을 하세요.""","하루 세 끼 식사를 규칙적으로 하고, 간식은 건강한 선택을 하세요."
5,물 섭취를 늘리기 위해 매 식사 전후로 한 잔의 물을 마시는 습관을 들이세요. 충분한 수분 섭취는 대사 기능을 돕습니다.,"""갑상선 기능을 지속적으로 강화하기 위해 규칙적인 신체활동을 추천합니다.""",갑상선 기능을 지속적으로 강화하기 위해 규칙적인 신체활동을 추천합니다.
5,잡곡밥과 함께 다양한 채소로 만든 비빔밥을 드셔보세요. 잡곡밥은 철분과 식이섬유를 제공합니다.,"""스트레스와 불안을 관리하기 위해 규칙적인 운동을 실천하세요.""",스트레스와 불안을 관리하기 위해 규칙적인 운동을 실천하세요.
5,샌드위치를 준비할 때는 마요네즈 대신 아보카도 스프레드를 사용해보세요. 아보카도에는 건강한 지방과 섬유질이 풍부합니다.,"""갑상선 저하증 환자에게는 과다한 카페인과 알코올을 피하도록 하세요.""",갑상선 저하증 환자에게는 과다한 카페인과 알코올을 피하도록 하세요.
5,샐러드를 드실 때는 닭가슴살이나 퀴노아를 추가하여 단백질 섭취를 높이세요. 퀴노아는 완전 단백질과 식이섬유를 제공합니다.,"""규칙적인 식사와 함께 적절한 운동을 통해 체중을 관리하세요.""",규칙적인 식사와 함께 적절한 운동을 통해 체중을 관리하세요.
5,신선한 베리를 넣은 스무디를 만들어 드시면 비타민과 항산화제를 함께 섭취할 수 있습니다. 베리는 항산화제가 풍부합니다.,"""갑상선 저하증 환자는 식사 전과 후에 물을 충분히 섭취하세요.""",갑상선 저하증 환자는 식사 전과 후에 물을 충분히 섭취하세요.
5,저지방 요구르트에 신선한 과일과 견과류를 추가하여 드시면 좋습니다. 요구르트는 프로바이오틱스와 칼슘을 제공합니다.,"""건강한 식습관을 유지하고, 신체 활동을 통해 건강을 지키세요.""","건강한 식습관을 유지하고, 신체 활동을 통해 건강을 지키세요."
5,식사 후 디저트로는 케이크 대신 과일 샐러드를 준비해보세요. 과일 샐러드는 비타민과 항산화제가 풍부합니다.,"""체중을 감량하고 싶다면 운동과 식이조절을 규칙적으로 실천하세요.""",체중을 감량하고 싶다면 운동과 식이조절을 규칙적으로 실천하세요.
5,매 끼니마다 섬유질 섭취를 위해 채소와 과일을 충분히 포함시키세요. 섬유질은 소화를 돕고 포만감을 유지해줍니다.,"""갑상선 기능을 유지하기 위해 정기적인 검진을 받으세요.""",갑상선 기능을 유지하기 위해 정기적인 검진을 받으세요.
5,당도가 높은 과자보다는 생과일을 선택하세요. 생과일에는 비타민과 미네랄이 풍부합니다.,"""하루 규칙적인 식사와 함께 적절한 수면을 취해 체력을 회복하세요.""",하루 규칙적인 식사와 함께 적절한 수면을 취해 체력을 회복하세요.
5,요오드가 풍부한 미역과 단백질이 많은 두부를 넣어 만든 미역국을 끓여 드시면 갑상선 기능을 촉진할 수 있습니다.,정기적으로 요가나 필라테스 수업을 들어보세요.,정기적으로 요가나 필라테스 수업을 들어보세요.
5,셀레늄이 풍부한 브라질너트와 다양한 신선한 채소를 넣어 만든 샐러드는 갑상선 건강에 도움을 줍니다.,하루에 한 번은 눈을 감고 5분간 명상을 해보세요.,하루에 한 번은 눈을 감고 5분간 명상을 해보세요.
5,구운 연어와 아보카도를 넣어 만든 샐러드는 오메가-3 지방산과 건강한 지방을 제공하여 갑상선 기능을 지원합니다.,친구와 함께 운동을 하며 동기부여를 얻으세요.,친구와 함께 운동을 하며 동기부여를 얻으세요.
5,현미밥과 시금치를 곁들인 한식 비빔밥은 섬유질과 비타민이 풍부하여 갑상선 건강을 유지하는 데 좋습니다.,매일 웃는 시간을 가져보세요.,매일 웃는 시간을 가져보세요.
5,철분이 많은 시금치와 단백질이 풍부한 달걀을 넣어 만든 볶음밥은 영양 가득한 한 끼 식사로 좋습니다.,하루에 한 번은 깊게 심호흡을 하며 스트레스를 해소하세요.,하루에 한 번은 깊게 심호흡을 하며 스트레스를 해소하세요.
5,소고기와 요오드가 풍부한 미역을 넣어 끓인 한식 미역국은 철분과 요오드를 동시에 보충할 수 있습니다.,규칙적으로 취미 활동을 통해 삶의 질을 높이세요.,규칙적으로 취미 활동을 통해 삶의 질을 높이세요.
5,병아리콩과 다양한 채소를 넣어 만든 샐러드는 철분과 비타민을 동시에 공급하여 갑상선 건강에 도움을 줍니다.,일주일에 한 번은 새로운 요리를 시도해 보세요.,일주일에 한 번은 새로운 요리를 시도해 보세요.
5,생강과 마늘을 넣어 구운 닭가슴살과 신선한 채소를 함께 드시면 항염 작용이 있어 갑상선 기능을 지원합니다.,정기적으로 플랭크와 같은 코어 운동을 하세요.,정기적으로 플랭크와 같은 코어 운동을 하세요.
5,오메가-3 지방산이 풍부한 고등어를 구워서 시금치와 함께 드시면 갑상선 건강에 유익한 영향을 줍니다.,일주일에 한 번은 자신만의 휴식 시간을 가지세요.,일주일에 한 번은 자신만의 휴식 시간을 가지세요.
5,청경채와 섬유질이 풍부한 현미밥을 함께 드시면 비타민과 미네랄을 동시에 공급하여 갑상선 기능을 촉진합니다.,하루에 한 번은 감사한 일을 떠올려보세요.,하루에 한 번은 감사한 일을 떠올려보세요.
5,구운 간과 신선한 시금치를 넣어 만든 샐러드는 철분과 비타민 C를 함께 섭취하여 철분 흡수를 도와줍니다.,매일 아침 간단한 스트레칭으로 몸을 깨우세요.,매일 아침 간단한 스트레칭으로 몸을 깨우세요.
5,시금치와 단백질이 많은 두부를 넣어 만든 된장찌개는 갑상선 기능을 유지하는 데 좋은 영양을 제공합니다.,하루에 10분씩 바른 자세로 앉아 명상을 해보세요.,하루에 10분씩 바른 자세로 앉아 명상을 해보세요.
5,소고기 불고기와 비타민 C가 많은 콩나물 무침을 함께 드시면 철분과 비타민을 동시에 보충할 수 있습니다.,매일 식단에 신선한 과일과 채소를 포함하세요.,매일 식단에 신선한 과일과 채소를 포함하세요.
5,시금치와 두부를 넣어 만든 샐러드는 철분과 단백질을 함께 섭취하여 갑상선 건강을 지원합니다.,일주일에 한 번은 자신에게 휴식 시간을 주세요.,일주일에 한 번은 자신에게 휴식 시간을 주세요.
5,시금치와 비타민 C가 많은 김치를 넣어 만든 비빔국수는 영양 밸런스를 맞춰주어 갑상선 건강에 도움을 줍니다.,하루에 한 번은 새로운 것을 시도해 보세요.,하루에 한 번은 새로운 것을 시도해 보세요.
