code,recommendation,recommendation2,recommendation3
2,섬유질이 풍부한 현미밥과 비타민 C가 많은 오이를 넣어 만든 현미밥 오이 비빔밥은 소화를 돕고 혈중 지질 수치를 조절하는 데 유익합니다.,자신에게 맞는 영양제를 찾아 꾸준히 섭취하세요.,자신에게 맞는 영양제를 찾아 꾸준히 섭취하세요.
2,항산화제가 많은 브로콜리와 단백질이 풍부한 두부를 넣어 만든 브로콜리 두부 샐러드는 혈관 건강에 도움을 줍니다.,일주일에 한 번은 자연 속에서 시간을 보내세요.,일주일에 한 번은 자연 속에서 시간을 보내세요.
2,비타민이 많은 양배추와 오메가-3 지방산이 풍부한 고등어를 넣어 만든 양배추 고등어 샐러드는 혈중 콜레스테롤 수치를 낮추는 데 좋습니다.,매일 아침 간단한 스트레칭으로 몸을 깨우세요.,매일 아침 간단한 스트레칭으로 몸을 깨우세요.
2,섬유질이 풍부한 보리밥과 다양한 채소를 넣어 만든 보리밥 비빔밥은 소화를 돕고 혈중 지질 수치를 개선하는 데 도움이 됩니다.,하루에 한 번은 긍정적인 마인드로 명상을 해보세요.,하루에 한 번은 긍정적인 마인드로 명상을 해보세요.
2,항산화제가 많은 시금치와 비타민 C가 풍부한 토마토를 넣어 만든 시금치 토마토 샐러드는 혈관 건강에 유익합니다.,규칙적으로 취미 활동을 하여 스트레스를 해소하세요.,규칙적으로 취미 활동을 하여 스트레스를 해소하세요.
2,단백질이 많은 두부와 다양한 신선한 채소를 넣어 만든 두부 채소 샐러드는 건강한 지방 섭취를 도와주어 혈중 지질 수치를 조절하는 데 좋습니다.,매일 식단에 신선한 과일과 채소를 포함하세요.,매일 식단에 신선한 과일과 채소를 포함하세요.
3,피로를 풀기 위해 커피 대신 카페인이 적은 허브차를 드시는 것을 추천드립니다. 허브차는 진정 효과가 있습니다.,"""오늘도 수고 많으셨습니다. 지방간 관리를 위해 정기적으로 유산소 운동을 해보세요.""",오늘도 수고 많으셨습니다. 지방간 관리를 위해 정기적으로 유산소 운동을 해보세요.
3,샐러드에 레몬즙을 추가하여 상큼함과 비타민C를 더해보세요. 비타민 C는 면역 기능을 지원합니다.,"""포화지방 섭취를 줄이고, 식물성 기름을 사용하여 요리해보세요.""","포화지방 섭취를 줄이고, 식물성 기름을 사용하여 요리해보세요."
3,"식사 시에는 정제된 설탕 사용을 줄이고, 꿀이나 메이플 시럽을 대체해보세요. 꿀과 메이플 시럽은 자연적인 단맛을 제공합니다.","""건강한 체중을 유지하는 것이 중요합니다. 체중 감량을 위해 식단을 조절하세요.""",건강한 체중을 유지하는 것이 중요합니다. 체중 감량을 위해 식단을 조절하세요.
3,"흰빵 대신 통밀빵을 선택하시고, 과일주스 대신 신선한 과일을 드시는 것을 권장드립니다. 통밀빵에는 섬유질이 풍부해 콜레스테롤 수치를 낮추는 데 도움이 됩니다.","""단 음식을 피하고, 저당 식품을 선택하여 혈당 수치를 관리하세요.""","단 음식을 피하고, 저당 식품을 선택하여 혈당 수치를 관리하세요."
3,"백미 대신 현미밥을 드시고, 고기 대신 오메가-3가 풍부한 연어를 드시는 것이 좋습니다. 오메가-3는 트리글리세리드 수치를 낮춥니다.","""알코올 섭취를 줄이고, 신선한 과일 주스를 마시는 것을 권장드립니다.""","알코올 섭취를 줄이고, 신선한 과일 주스를 마시는 것을 권장드립니다."
3,"채소가 풍부한 샐러드를 준비하시고, 샐러드 드레싱은 저지방 요구르트와 레몬즙을 사용하는 것을 추천드립니다. 레몬즙은 항산화 효과가 있습니다.","""섬유질이 풍부한 식사를 하세요. 채소와 과일을 충분히 드세요.""",섬유질이 풍부한 식사를 하세요. 채소와 과일을 충분히 드세요.
3,고당도 과일보다는 섬유질이 풍부한 사과나 배를 선택해보세요. 섬유질은 콜레스테롤 수치를 낮추는 데 도움이 됩니다.,"""가공식품과 패스트푸드 섭취를 줄이고, 신선한 재료로 만든 음식을 드세요.""","가공식품과 패스트푸드 섭취를 줄이고, 신선한 재료로 만든 음식을 드세요."
3,계란 요리를 할 때는 튀기기보다는 삶거나 찐 계란을 드시는 것이 좋습니다. 계란에는 양질의 단백질이 포함되어 있습니다.,"""지방간 관리를 위해 하루에 충분한 물을 마시세요.""",지방간 관리를 위해 하루에 충분한 물을 마시세요.
3,음료는 당분이 높은 탄산음료보다는 무가당 녹차나 허브티를 드시는 것을 권장드립니다. 녹차는 항산화제가 풍부해 심혈관 건강에 도움이 됩니다.,"""적절한 수면을 취하여 몸의 피로를 회복하세요.""",적절한 수면을 취하여 몸의 피로를 회복하세요.
3,"육류 섭취 시에는 기름기가 적은 닭가슴살이나 칠면조를 선택하시고, 조리 시에는 굽기나 찌기를 이용해보세요. 닭가슴살은 단백질이 풍부합니다.","""정기적으로 건강 검진을 받아 간 상태를 체크하세요.""",정기적으로 건강 검진을 받아 간 상태를 체크하세요.
3,통밀빵에 저지방 참치와 채소를 넣어 샌드위치를 만들어 드세요. 참치 샌드위치는 만들기도 쉽고 건강에 아주 좋습니다.,"""적당한 운동을 통해 간의 지방 축적을 줄이세요.""",적당한 운동을 통해 간의 지방 축적을 줄이세요.
3,"시리얼 대신 오트밀을 드시고, 우유는 저지방 또는 무지방 우유로 대체해보세요. 오트밀은 콜레스테롤을 낮추는 데 도움을 줍니다.","""스트레스를 줄이기 위해 명상이나 요가를 해보세요.""",스트레스를 줄이기 위해 명상이나 요가를 해보세요.
3,고당도 과일보다는 섬유질이 풍부한 사과나 배를 선택해보세요. 섬유질은 콜레스테롤 수치를 낮추는 데 도움이 됩니다.,"""알코올을 피하고, 물과 허브차를 자주 마시세요.""","알코올을 피하고, 물과 허브차를 자주 마시세요."
3,생선 섭취를 늘리기 위해 주 2회 정도 등푸른 생선인 고등어나 정어리를 드시는 것을 권장드립니다. 등푸른 생선에는 오메가-3가 풍부합니다.,"""단백질이 풍부한 식사를 하여 간 기능을 돕세요.""",단백질이 풍부한 식사를 하여 간 기능을 돕세요.
3,견과류 섭취 시에는 소금이 가미되지 않은 생아몬드나 호두를 선택하시면 좋습니다. 견과류는 건강한 지방과 비타민 E를 제공합니다.,"""규칙적인 식사 습관을 유지하고, 과식을 피하세요.""","규칙적인 식사 습관을 유지하고, 과식을 피하세요."
3,채소 섭취를 늘리기 위해 매 끼니마다 다양한 색상의 채소를 골고루 드시는 것을 추천드립니다. 다양한 색상의 채소에는 비타민과 미네랄이 풍부합니다.,"""체중 감량을 위해 식사량을 적절히 조절하세요.""",체중 감량을 위해 식사량을 적절히 조절하세요.
3,육류 대신 단백질을 보충할 수 있도록 두부나 콩류를 자주 드셔보세요. 두부와 콩류는 식물성 단백질과 철분을 제공합니다.,"""지방간 관리를 위해 정기적으로 걷기 운동을 해보세요.""",지방간 관리를 위해 정기적으로 걷기 운동을 해보세요.
3,고구마나 당근 스틱처럼 건강한 채소를 이용한 요리를 준비해보세요. 고구마와 당근에는 베타카로틴과 비타민 A가 풍부합니다.,"""건강한 지방을 섭취하세요. 아보카도와 올리브오일이 좋습니다.""",건강한 지방을 섭취하세요. 아보카도와 올리브오일이 좋습니다.
3,"조미료 사용을 줄이고, 신선한 허브나 향신료를 활용해 요리해보세요. 허브와 향신료는 항산화 효과가 있습니다.","""과일과 채소를 충분히 섭취하여 비타민을 보충하세요.""",과일과 채소를 충분히 섭취하여 비타민을 보충하세요.
3,"블루베리, 그릭 요거트, 아몬드 밀크를 섞어 블루베리 스무디를 만들어보세요.","""고지방 육류 대신에 닭 가슴살이나 생선을 선택하세요.""",고지방 육류 대신에 닭 가슴살이나 생선을 선택하세요.
3,정제된 곡물보다는 통곡물을 선택하여 영양소와 섬유질 섭취를 늘리세요. 통곡물에는 비타민 B군과 식이섬유가 풍부합니다.,"""정기적으로 간 상태를 체크하고, 의사의 지시에 따라 치료하세요.""","정기적으로 간 상태를 체크하고, 의사의 지시에 따라 치료하세요."
3,잡곡밥과 함께 브로콜리와 토마토를 곁들인 가벼운 훈제 오리고기를 섭취하세요.,"""스트레스를 줄이기 위해 취미 활동을 즐기세요.""",스트레스를 줄이기 위해 취미 활동을 즐기세요.
3,잡곡밥과 함께 다양한 채소로 만든 비빔밥을 드셔보세요. 잡곡밥은 철분과 식이섬유를 제공합니다.,"""카페인 섭취를 줄이고, 따뜻한 허브차를 마시는 것을 권장드립니다.""","카페인 섭취를 줄이고, 따뜻한 허브차를 마시는 것을 권장드립니다."
3,샌드위치를 준비할 때는 마요네즈 대신 아보카도 스프레드를 사용해보세요. 아보카도에는 건강한 지방과 칼륨이 풍부합니다.,"""단 음식을 피하고, 건강한 간식을 선택하세요.""","단 음식을 피하고, 건강한 간식을 선택하세요."
3,샐러드를 드실 때는 닭가슴살이나 퀴노아를 추가하여 단백질 섭취를 높이세요. 퀴노아는 완전 단백질과 식이섬유를 제공합니다.,"""규칙적인 운동으로 체중을 관리하고, 간 건강을 지키세요.""","규칙적인 운동으로 체중을 관리하고, 간 건강을 지키세요."
3,신선한 베리를 넣은 스무디를 만들어 드시면 비타민과 항산화제를 함께 섭취할 수 있습니다. 베리는 항산화제가 풍부합니다.,"""포화지방을 피하고, 불포화지방을 선택하여 요리하세요.""","포화지방을 피하고, 불포화지방을 선택하여 요리하세요."
3,"통곡물 파스타와 미네랄과 식이 섬유가 풍부한 아티초크를 드시고, 페퍼민트 차를 함께 드세요.","""적절한 수면을 취하여 신체 리듬을 유지하세요.""",적절한 수면을 취하여 신체 리듬을 유지하세요.
3,식사 후 디저트로는 케이크 대신 과일 샐러드를 준비해보세요. 과일 샐러드는 비타민과 항산화제가 풍부합니다.,"""섬유질이 풍부한 식단을 유지하여 소화 기능을 돕세요.""",섬유질이 풍부한 식단을 유지하여 소화 기능을 돕세요.
3,섬유질이 풍부한 시금치와 고단백 닭가슴살을 넣어 만든 닭가슴살 샐러드는 지방간 관리에 도움을 줄 수 있습니다.,매일 아침 30분씩 걷기 운동을 해보세요.,매일 아침 30분씩 걷기 운동을 해보세요.
3,비타민과 미네랄이 풍부한 브로콜리와 현미밥을 넣어 만든 브로콜리 현미 비빔밥은 건강한 식사로 추천드립니다.,저염식을 실천하여 나트륨 섭취를 줄여보세요.,저염식을 실천하여 나트륨 섭취를 줄여보세요.
3,저칼로리 해초와 단백질이 풍부한 두부를 넣어 만든 미역 두부국은 지방간 관리에 좋습니다.,신선한 채소와 과일을 매일 식단에 포함시키세요.,신선한 채소와 과일을 매일 식단에 포함시키세요.
3,다양한 채소와 신선한 연두부를 넣어 만든 연두부 샐러드는 비타민과 미네랄을 보충하여 건강을 유지하는 데 도움을 줍니다.,정기적으로 혈압을 측정하여 건강 상태를 체크하세요.,정기적으로 혈압을 측정하여 건강 상태를 체크하세요.
3,단백질이 많은 닭가슴살과 신선한 채소를 넣어 만든 닭가슴살 샐러드는 지방간 관리에 좋은 선택입니다.,매일 2리터 이상의 물을 마셔서 수분을 충분히 섭취하세요.,매일 2리터 이상의 물을 마셔서 수분을 충분히 섭취하세요.
3,항산화제가 풍부한 양배추와 비타민 C가 많은 오이를 넣어 만든 양배추 오이 샐러드는 신선하고 건강한 한 끼 식사입니다.,저지방 단백질 식품을 선택하여 식단을 구성하세요.,저지방 단백질 식품을 선택하여 식단을 구성하세요.
3,섬유질이 풍부한 현미와 다양한 채소를 넣어 만든 현미 비빔밥은 포만감을 주며 건강한 식사로 추천드립니다.,스트레칭으로 하루를 시작하여 근육을 풀어보세요.,스트레칭으로 하루를 시작하여 근육을 풀어보세요.
3,비타민 C가 많은 브로콜리와 단백질이 풍부한 두부를 넣어 만든 브로콜리 두부 샐러드는 건강을 유지하는 데 좋습니다.,식사 후 30분 정도 가벼운 산책을 해보세요.,식사 후 30분 정도 가벼운 산책을 해보세요.
3,단백질이 풍부한 연두부와 신선한 채소를 넣어 만든 연두부 샐러드는 영양가 높은 한 끼 식사로 이상적입니다.,저녁에는 가볍게 먹고 일찍 잠자리에 드세요.,저녁에는 가볍게 먹고 일찍 잠자리에 드세요.
3,섬유질이 많은 시금치와 단백질이 풍부한 닭가슴살을 넣어 만든 시금치 닭가슴살 샐러드는 지방간 관리에 유익합니다.,TV나 컴퓨터 앞에서 식사하지 않도록 하세요.,TV나 컴퓨터 앞에서 식사하지 않도록 하세요.
3,비타민이 풍부한 양배추와 당근을 넣어 만든 양배추 당근 샐러드는 신선하고 건강한 식사로 추천드립니다.,음식의 칼로리와 나트륨 함량을 확인하는 습관을 가지세요.,음식의 칼로리와 나트륨 함량을 확인하는 습관을 가지세요.
3,섬유질이 많은 현미와 비타민 C가 풍부한 브로콜리를 넣어 만든 현미 브로콜리 비빔밥은 건강을 유지하는 데 좋습니다.,무가당 음료나 물을 주로 마셔보세요.,무가당 음료나 물을 주로 마셔보세요.
3,단백질이 많은 두부와 비타민 C가 많은 오이를 넣어 만든 두부 오이 샐러드는 신선하고 건강한 한 끼 식사입니다.,정기적으로 요가나 명상을 통해 스트레스를 관리하세요.,정기적으로 요가나 명상을 통해 스트레스를 관리하세요.
3,항산화제가 풍부한 시금치와 단백질이 많은 닭가슴살을 넣어 만든 시금치 닭가슴살 샐러드는 지방간 관리에 좋습니다.,규칙적인 운동 루틴을 만들어 꾸준히 실천하세요.,규칙적인 운동 루틴을 만들어 꾸준히 실천하세요.
3,비타민과 미네랄이 많은 양배추와 브로콜리를 넣어 만든 양배추 브로콜리 샐러드는 건강을 유지하는 데 도움이 됩니다.,일주일에 한 번은 건강 검진을 받으세요.,일주일에 한 번은 건강 검진을 받으세요.
3,섬유질이 많은 현미와 단백질이 많은 두부를 넣어 만든 현미 두부 비빔밥은 건강한 식사로 이상적입니다.,자기 전에 스마트폰 사용을 줄이고 책을 읽어보세요.,자기 전에 스마트폰 사용을 줄이고 책을 읽어보세요.
3,항산화제가 풍부한 시금치와 비타민 C가 많은 오이를 넣어 만든 시금치 오이 샐러드는 신선하고 건강한 한 끼 식사입니다.,가공식품보다는 자연식품을 선택하세요.,가공식품보다는 자연식품을 선택하세요.
3,비타민이 풍부한 양배추와 단백질이 많은 닭가슴살을 넣어 만든 양배추 닭가슴살 샐러드는 지방간 관리에 유익합니다.,과일을 간식으로 먹고 단 음식을 피하세요.,과일을 간식으로 먹고 단 음식을 피하세요.
3,섬유질이 많은 현미와 항산화제가 풍부한 브로콜리를 넣어 만든 현미 브로콜리 비빔밥은 건강을 유지하는 데 좋습니다.,매일 감사 일기를 써보세요.,매일 감사 일기를 써보세요.
3,단백질이 많은 두부와 다양한 채소를 넣어 만든 두부 채소 샐러드는 신선하고 영양가 높은 한 끼 식사입니다.,아침 식사를 꼭 챙겨 먹고 규칙적인 식사 시간을 유지하세요.,아침 식사를 꼭 챙겨 먹고 규칙적인 식사 시간을 유지하세요.
3,비타민이 풍부한 시금치와 항산화제가 많은 오이를 넣어 만든 시금치 오이 샐러드는 건강한 식사로 이상적입니다.,무리하지 않는 선에서 근력 운동을 추가해보세요.,무리하지 않는 선에서 근력 운동을 추가해보세요.
3,항산화제가 풍부한 양배추와 단백질이 많은 닭가슴살을 넣어 만든 양배추 닭가슴살 샐러드는 지방간 관리에 좋습니다.,하루에 10분씩 명상이나 심호흡을 해보세요.,하루에 10분씩 명상이나 심호흡을 해보세요.
3,섬유질이 많은 현미와 비타민 C가 풍부한 브로콜리를 넣어 만든 현미 브로콜리 비빔밥은 건강을 유지하는 데 도움이 됩니다.,식사 시간을 충분히 갖고 천천히 먹어보세요.,식사 시간을 충분히 갖고 천천히 먹어보세요.
3,단백질이 많은 두부와 신선한 채소를 넣어 만든 두부 채소 샐러드는 영양가 높은 한 끼 식사로 추천드립니다.,가족이나 친구와 함께 운동을 해보세요.,가족이나 친구와 함께 운동을 해보세요.
3,비타민이 풍부한 시금치와 항산화제가 많은 오이를 넣어 만든 시금치 오이 샐러드는 신선하고 건강한 식사로 이상적입니다.,음식을 소금 대신 허브나 향신료로 간을 맞춰보세요.,음식을 소금 대신 허브나 향신료로 간을 맞춰보세요.
3,섬유질이 많은 현미와 비타민 C가 풍부한 브로콜리를 넣어 만든 현미 브로콜리 비빔밥은 포만감을 주며 건강을 유지하는 데 좋습니다.,외식할 때는 나트륨 함량이 낮은 메뉴를 선택하세요.,외식할 때는 나트륨 함량이 낮은 메뉴를 선택하세요.
3,단백질이 많은 두부와 항산화제가 많은 양배추를 넣어 만든 두부 양배추 샐러드는 건강한 식사로 이상적입니다.,하루에 한 번은 충분히 웃는 시간을 가지세요.,하루에 한 번은 충분히 웃는 시간을 가지세요.
3,비타민이 풍부한 시금치와 단백질이 많은 닭가슴살을 넣어 만든 시금치 닭가슴살 샐러드는 지방간 관리에 유익합니다.,정기적으로 마사지나 스파를 통해 스트레스를 해소하세요.,정기적으로 마사지나 스파를 통해 스트레스를 해소하세요.
3,섬유질이 많은 현미와 다양한 채소를 넣어 만든 현미 채소 비빔밥은 신선하고 건강한 식사로 추천드립니다.,아침에 일어나면 찬물로 얼굴을 씻어보세요.,아침에 일어나면 찬물로 얼굴을 씻어보세요.
3,비타민이 풍부한 양배추와 단백질이 많은 두부를 넣어 만든 양배추 두부 샐러드는 지방간 관리에 도움을 줍니다.,하루에 5분씩 바른 자세로 앉아 명상을 해보세요.,하루에 5분씩 바른 자세로 앉아 명상을 해보세요.
4,매 끼니마다 섬유질 섭취를 위해 채소와 과일을 충분히 포함시키세요. 섬유질은 소화를 돕고 포만감을 유지해줍니다.,"""오늘 하루도 수고 많으셨습니다. 체중 관리를 위해 하루 30분 이상 걷기 운동을 해보세요.""",오늘 하루도 수고 많으셨습니다. 체중 관리를 위해 하루 30분 이상 걷기 운동을 해보세요.
4,당도가 높은 과자보다는 생과일을 선택하세요. 생과일에는 비타민과 미네랄이 풍부합니다.,"""균형 잡힌 식단을 유지하고, 과식을 피하세요. 작은 접시를 사용하면 도움이 됩니다.""","균형 잡힌 식단을 유지하고, 과식을 피하세요. 작은 접시를 사용하면 도움이 됩니다."
4,피로를 풀기 위해 커피 대신 카페인이 적은 허브차를 드시는 것을 추천드립니다. 허브차는 진정 효과가 있습니다.,"""식사 전에 물을 한 컵 마시면 포만감을 느끼는데 도움이 됩니다.""",식사 전에 물을 한 컵 마시면 포만감을 느끼는데 도움이 됩니다.
4,샐러드에 레몬즙을 추가하여 상큼함과 비타민C를 더해보세요. 비타민 C는 면역 기능을 지원합니다.,"""건강한 간식을 선택하세요. 과일이나 요거트가 좋은 선택입니다.""",건강한 간식을 선택하세요. 과일이나 요거트가 좋은 선택입니다.
4,그린 스무디를 만들어 신선한 시금치와 케일을 추가해 보세요. 시금치와 케일은 비타민 K와 항산화제가 풍부합니다.,"""규칙적인 운동을 통해 체중을 감량하고 건강을 유지하세요.""",규칙적인 운동을 통해 체중을 감량하고 건강을 유지하세요.
4,"잡곡밥과 함께 철분이 풍부한 시금치와 삶은 계란을 함께 섭취하시고, 생강차를 마시는 것을 추천드립니다.","""가공식품과 패스트푸드 섭취를 줄이고, 신선한 재료로 요리하세요.""","가공식품과 패스트푸드 섭취를 줄이고, 신선한 재료로 요리하세요."
4,미역국이나 국수보다는 단백질이 풍부한 두부와 함께 샐러드를 드시는 것이 좋습니다.,"""하루에 충분한 물을 마셔서 몸의 수분을 유지하세요.""",하루에 충분한 물을 마셔서 몸의 수분을 유지하세요.
4,비타민 B가 풍부한 닭가슴살 샐러드를 먹어서 체지방을 관리하세요.,"""포화지방과 설탕 섭취를 줄이고, 식이섬유가 풍부한 음식을 드세요.""","포화지방과 설탕 섭취를 줄이고, 식이섬유가 풍부한 음식을 드세요."
4,고단백 저지방의 국수보다는 차가운 국수를 드시는 것이 지방간에 좋습니다.,"""적절한 수면을 취해 피로를 회복하고, 체중 관리에 도움이 되도록 하세요.""","적절한 수면을 취해 피로를 회복하고, 체중 관리에 도움이 되도록 하세요."
4,샐러드와 함께 단백질이 풍부한 계란을 섭취하여 체지방을 낮추세요.,"""하루 세 끼 규칙적으로 식사하고, 식사 시간을 지키세요.""","하루 세 끼 규칙적으로 식사하고, 식사 시간을 지키세요."
4,"파질 페스토 파스타는 어떠신가요? 통곡물 파스타에 바질, 마늘, 잣, 올리브 오일로 만든 페스토 소스를 곁들여 드세요.","""음식을 천천히 씹어 먹으면 포만감을 더 빨리 느낄 수 있습니다.""",음식을 천천히 씹어 먹으면 포만감을 더 빨리 느낄 수 있습니다.
4,"병아리콩 스튜를 추천드립니다. 병아리콩은 단백질과 섬유질을, 당근과 토마토는 비타민 A와 C를 공급하여 면역력 강화에 도움을 줍니다.","""스트레스를 줄이기 위해 명상이나 요가를 해보세요.""",스트레스를 줄이기 위해 명상이나 요가를 해보세요.
4,참치는 단백질과 오메가-3 지방산이 풍부하여 심혈관 건강에 좋습니다. 레몬즙은 비타민 C를 제공합니다.,"""건강한 체중을 유지하기 위해 꾸준한 운동을 실천하세요.""",건강한 체중을 유지하기 위해 꾸준한 운동을 실천하세요.
4,두부와 시금치가 들어간 된장찌개를 먹어서 체지방을 관리하세요.,"""단 음식을 피하고, 저당 식품을 선택하여 혈당 수치를 관리하세요.""","단 음식을 피하고, 저당 식품을 선택하여 혈당 수치를 관리하세요."
4,영양가가 높은 잡곡밥과 함께 채소와 고구마를 함께 섭취하여 영양을 공급하세요.,"""식사 후에는 바로 앉아있기보다는 가벼운 산책을 해보세요.""",식사 후에는 바로 앉아있기보다는 가벼운 산책을 해보세요.
4,단백질이 풍부한 우유와 함께 오트밀을 먹어서 체력을 회복하세요.,"""건강한 식단을 유지하고, 적당한 운동을 통해 체중을 관리하세요.""","건강한 식단을 유지하고, 적당한 운동을 통해 체중을 관리하세요."
4,아보카도와 토마토를 골고루 넣은 샐러드를 먹어서 체지방을 조절하세요.,"""알코올 섭취를 줄이고, 물이나 허브차를 마시는 것을 권장드립니다.""","알코올 섭취를 줄이고, 물이나 허브차를 마시는 것을 권장드립니다."
4,고기 대신 닭가슴살을 이용한 샐러드를 드시는 것이 좋습니다.,"""규칙적인 운동 습관을 길러 체중 감량을 도모하세요.""",규칙적인 운동 습관을 길러 체중 감량을 도모하세요.
4,단백질이 풍부한 생선과 함께 야채를 골고루 넣은 찜요리를 먹어서 체지방을 낮추세요.,"""체중 관리를 위해 섬유질이 풍부한 식사를 하세요.""",체중 관리를 위해 섬유질이 풍부한 식사를 하세요.
4,오트밀은 섬유질과 베타글루칸이 풍부하여 콜레스테롤 수치를 낮추는 데 도움을 줍니다. 견과류는 건강한 지방과 단백질을 제공합니다.,"""가공식품을 피하고, 신선한 재료로 만든 음식을 드세요.""","가공식품을 피하고, 신선한 재료로 만든 음식을 드세요."
